,name,line
2315,Arthur,We were supposed to meet up at the outskirts of town and head to the parade together. I explained all this to Cain. It's already time...... Did something happen? Maybe I should go and check.
2316,Cock Robin,"Y-you can't! Prince Arthur, if you're gone too-...."
2317,Arthur,"Then could you go check on them for me, Cock Robin?"
2318,Cock Robin,"I understand. If I hurry by carriage, I'll be there in half a day -"
2319,Arthur,"No, that'd be too late. If you fly at the speed of a frigate bird, you should be there in no time."
2320,Cock Robin,"Well, sure, but I'm not a frigate bird...... ......!?"
2321,Arthur,<< Pernoctant Nixzo >>
2322,Narrator,(Wings flapping)
2323,Cock Robin,"Squawk, squawk squawk squawk!?"
2324,Arthur,"I'm counting on you, Cock Robin."
2325,Cock Robin,Squawk......squawk squawk!
2326,Heathcliff,Your nails....? You paint your nails?
2327,Chloe,"Yup, isn't it cute? I'll paint yours too, Heath!"
2328,Heathcliff,"Uh, umm....?"
2329,Shylock,"It's actually quite sensible to decorate your fingertips. We cast spells with our fingers when we're not using our magic tools, after all. Putting effort into them will increase your power."
2330,Chloe,"Really! Okay then, I'm gonna make them even fancier..... Woah....!"
2331,Little sheep,"Baa, baa! Baa!"
2332,Riquet,Woah... Such tiny sheep!
2333,Mitile,Aren't Mister Leno's sheep so cute?
2334,Lennox,"I didn't know when we'd get to go home, so I made them small and brought them with me."
2335,Figaro,"Yawn.... It's been a while since I've had this much free time. Rutile, can you brew me some tea?"
2336,Rutile,"Dr. Figaro, you're going to get as round as a cow if you laze around all day."
2337,Figaro,"Hey, cows are great."
2338,Akira,"We were told to wait until another envoy came for us, so....."
2339,Cock Robin,"Grr-, squawk squawk!!"
2340,Chloe,"Woah, what now!? A frigate bird!?"
2341,Heathcliff,No... It's a person.....
2342,Figaro,Looks like he's under a spell. Here we go!
2343,Cock Robin,........hh.
2344,Akira,Mister Cock Robin.
2345,Cock Robin,Sir Sage! Why are you all just sitting around like this!?
2346,Akira,Huh? But we were told to wait here......
2347,Cock Robin,The parade's going to begin any moment now!
2348,Chloe,"Oh no, oh no, we need to hurry! I need to pack this and that and..... Oh, Rustica, are you all packed?"
2349,Rustica,"Yaawn.... Good morning. Why the rush, Chloe? There's still plenty of time till the party. I slept so well. Looks like it's time for some afternoon tea. Let me boil some water and....."
2350,Chloe,Save the tea for later! There was some kind of miscommunication - we need to hurry and leave right now!
2351,Rustica,Really. This is the first time I've heard about that.
2352,Chloe,"Because this is the first time I've mentioned it! Ah, your bedhead.....! Rustica, stay still, I'm gonna fix you up."
2353,Rustica,"Yaawn.... Okay, I'll pack my bag with magic. Some socks, a handkerchief, an umbrella....."
2354,Chloe,"Rustica, that's not an umbrella! That's some snake that was crawling around....!"
2355,Rustica,A necktie?
2356,Chloe,A snake....!
2357,Shino,"Can't they make up their minds? First they tell us to wait, then they tell us to come. What a fuss."
2358,Heathcliff,Look.... They probably have their reasons.
2359,Cain,"I'll lead you guys to the capital by broom. Cock Robin, give me the detailed rundown."
2360,Cock Robin,"Uh, umm, we're going to meet with Prince Arthur at the entrance of the city. Then we'll have you transfer over to the ceremonial carriages for the parade. There will be a crowd of people hoping to see you as the carriages make their way to the castle. If you could wave at them...."
2361,Cain,Got it. Let's go! Everyone follow me!
2362,Murr,There he goes.
2363,Shylock,Cain certainly enjoys leaping ahead and grabbing the reins - perhaps it's because he was the former general of the knights. Let's follow his lead.
2364,Cock Robin,"Ah, wait for me! What should I do.....!?"
2365,Figaro,"You can take the elevator. The headquarters' tower connects to the Central tower, right?"
2366,Snow,Unfortunately it doesn't seem to be functioning. Something might have happened to the Central tower.
2367,Rutile,"Then I can take you. I'll make sure you don't fall, so please hop onto the back of my broom."
2368,Cock Robin,Th-thank you! I'd feel perfectly comfortable riding behind a wizard as kind as you!
2369,Rutile,Leave it to me! I'll fly even faster than a frigate bird!
2370,Cock Robin,Huh?
2371,Figaro,"Hey, good luck. Rutile is usually very calm and gentle, but he's an absolute speed demon when he's flying."
2372,Cock Robin,Huh!?
2373,Rutile,Here we go~.
2374,Cock Robin,W-wai..... Aaaaaahhh......!
2375,Narrator,"The moment Cock Robin mounts the broom, Rutile shoots up into the air. They zip through the sky like a shooting star."
2376,Cock Robin,"Y-you're going too fast! Too fast.....!! Wait, please slow down.....!"
2377,Rutile,Huh? I can't really hear you~.
2378,Akira,W-will he be all right.....
2379,Lennox,I think he'll be fine. Rutile is flying slower than usual.
2380,Rustica,"Sir Sage, allow me to fly you there. May I take your hand?"
2381,Akira,"Ah.... Thank you, Rustica."
2382,Rustica,It's an honor.
2383,Narrator,"Rustica takes my hand and bows with the grace of a prince. He's the second wizard who's let me ride his broom, after Murr. Rustica has me sit in front of him, then wraps his arms around me from behind."
2384,Rustica,"Do excuse me. I know there are people who have their guests ride behind them, but I tend to be a bit careless, so. I'm always afraid that I might lose the person riding with me. So please bear with me for the course of this short flight."
2385,Narrator,I was growing a bit nervous at how close he was - speaking right into my ear - but his gentle and relaxing presence puts me at ease. The soft scent of his refined perfume brightens my mood.
2386,Akira,"Oh, it's fine. Thank you for letting me ride on your broom. Are you sure I'm not too heavy?"
2387,Rustica,"Not at all. I feel like I'm carrying a feather. Well then, shall we go? It might be a bit shaky at first, but we'll be flying steady soon enough. So please don't be afraid."
2388,Narrator,"Rustica's broom floats into the air, and I can feel the tips of my toes leave the ground."
2389,Narrator,(Whoosh)
2390,Narrator,"I realize that each wizard's personality is reflected in how they ride their broom. Murr's flight was a complete mess - a rollercoaster of a ride - but Rustica flies with a delicate, gentlemanly grace. I can see why Chloe is so attached to him."
2391,Rustica,Is the wind too chilly?
2392,Akira,"No, I'm all right."
2393,Rustica,"Sir Sage, how was the weather back in your country? Was it a cold place? Or was it quite warm?"
2394,Akira,"Well.... It was neither extremely hot nor extremely cold. It would get moderately warm, and moderately cold."
2395,Rustica,"That's wonderful. So you could have different experiences while living in one place. That means you're familiar with the flower that blooms in the gentle sunlight, the bright sky that glitters in scorching weather, and the snow that falls upon a freezing night."
2396,Akira,"Yes.... When you put it like that, I guess I am."
2397,Rustica,"Your country, and your life there - it all sounds like a beautiful poem."
2398,Narrator,"My heart grows warm at Rustica's straightforward praise. As I gaze at the vast, sprawling lands beneath us, I'm overcome by nostalgia for my world. I had forgotten about it because of how busy I was, but I loved that world and its four seasons."
2399,Akira,"Yes, it was.... I mean, my world had its problems too, but I still think it was a lovely place. And I like this world too. Day by day, I'm coming to like it more and more. It's mysterious, and beautiful, and a little scary....."
2400,Rustica,"That's wonderful. I'm happy to hear that, and I think this world would feel the same."
2401,Narrator,"A gentle wind blows through the sky and the earth. But as we fly on, the vast and beautiful landscape that had been flourishing with nature slowly begins to reveal the cruel scars of destruction."
2402,Mitile,There was a landslide over there.....
2403,Riquet,And there's a giant crack in the ground over there. Was there an earthquake?
2404,Lennox,How terrible... Catastrophes have left their scars across the land.....
2405,Cain,It must be because the < Great Catastrophe > got so close.... Prince Arthur said the Central capital was in terrible shape as well.
2406,Shino,The Eastern forest was a mess too.
2407,Heathcliff,Does that mean Blanchett Castle....?
2408,Shino,No. The castle region seemed to be relatively well-off. The forest must have protected it. Master and Mistress are both safe.
2409,Heathcliff,I see......
2410,Shino,"But magical creatures from the ancient past have been revived. For humans, it must feel like the end of the world."
2411,Figaro,I see. So that's why they need a hero.
2412,Rutile,....What do you mean?
2413,Cock Robin,Mister Rutile! Please don't make such a sharp turn!
2414,Figaro,"When the world is on the brink of despair, people yearn for heroes - for symbols of hope. But this will be a bit of a dangerous gamble."
2415,Chloe,A dangerous gamble? Why is it dangerous?
2416,Faust,Hmph. Because a hero can easily be transformed into a villain. There may be people who believe that we will save the world- But there are just as many who will claim that we will let the world fall to destruction because we are not strong enough. That's just how humans are.
2417,Shylock,Oh my. So that means we don't know whether the crowd will toss flowers or hurl stones at us during the parade.
2418,Akira,Oh no.....
2419,Chloe,"Eh....? I finally get to participate in a party and a parade, but everyone's just going to hate me again....?"
2420,Rustica,"Nobody will hate you, Chloe. They're all eagerly looking forward to meeting you."
2421,Chloe,But......
2422,Rustica,"Don't you agree, Sir Snow, Sir White?"
2423,Snow & White,"That's right, that's right! ....Is what we'd like to say, but......."
2424,Snow,Faust has good reason to worry. That was why we wanted to get Oz to bring Mithra and the others along.
2425,White,"Because humans fear Oz and the Northern wizards the most. If people see that even these wizards are with us, they'll surely feel at ease, but..... If they see that these wizards refuse to listen to us, it will simply compound their anxiety. For we won't look like we're working together."
2426,Chloe,But.... Does that mean that dressing up is pointless....? Nobody will welcome us...?
2427,Cain,"We just need to look confident, no matter the circumstances. There's no use in getting hung up on the fact that we failed to convince Oz. Plus, I bet Prince Arthur made extra preparations to make up for who we're missing."
2428,Riquet,"Indeed.... If we show the people that we are truly here to serve them as disciples of God, I am sure it will put their worries to rest."
2429,Shino,"What do you mean, serve? We're not slaves."
2430,Heathcliff,Shino......
2431,Shino,We were chosen for a role that we never asked for. Why do we have to suck up to people on top of that?
2432,Riquet,Isn't it simply right to use your God-granted powers for the greater good?
2433,Shino,"Who I choose to be of use to is a decision for me alone. I'm willing to sacrifice my life for my Master and Mistress at Blanchett. But if anyone else wants to use my power, they'd better beg me for it. I refuse to kiss up to a bunch of jerks who sit around and whine all day."
2434,Riquet,"....You are thinking like an oppressor. We are more fortunate than humans, and must....."
2435,Nero,"What do you mean, fortunate? They're out here throwing rocks at us. What do we get from fighting the < Great Catastrophe >? What do we get from fighting public criticism? Absolutely nothing."
2436,Rutile,"Please calm down, everyone.... Even so, I'm sure we can become a symbol of hope for somebody out there - just by existing. Once they remember what it feels like to hope, peace will return to their hearts. And they will no longer reach for rocks to hurl at us."
2437,Faust,How naive.
2438,Rutile,Mister Faust.....
2439,Faust,"Humans possessed by fear will easily carry out more horrifying cruelties than the most vicious wizard in the world. What if the crowd turns into a violent mob? What if they attempt to trample your brother to death? What will you do then, wizard of the South?"
2440,Rutile,I.....
2441,Figaro,I'll protect him.
2442,Rutile,Dr. Figaro.....
2443,Figaro,"And I will also protect you from the stones they hurl, Faust. Because I can smile in the face of such cruelty."
2444,Faust,...........
2445,Figaro,"I understand why you loathe humans. But at this rate, they'll simply see wizards as their enemies. We need to put smiles on our faces to make up for the Oz and the missing Northern wizards. Otherwise, we won't even be able to fight the catastrophes."
2446,Faust,Are you telling me to force a smile!?
2447,Figaro,Listen.....
2448,Lennox,I'll do it.
2449,Narrator,Everyone grows silent at Lennox's words.
2450,Lennox,"I will smile in your stead, Sir Faust, and for the rest of the Eastern wizards too."
2451,Narrator,We all turn around and look at the usually-quiet man with puzzled expressions on our faces.
2452,Mitile,"....You will, Mister Lennox?"
2453,Lennox,Yes.
2454,Mitile,"You're going to force a smile....? Um, I don't think I've really seen you smile all that much, Mister Lennox....."
2455,Lennox,Really?
2456,Mitile,Yes.... Could you please try to smile right now?
2457,Lennox,..........
2458,Lennox,....Like this?
2459,Narrator,"Lennox bares his teeth and grins. And in that moment, the tension among the wizards shatters as they burst into peals of laughter."
2460,Faust,Haha. Now that's certainly not it.
2461,Lennox,....Really?
2462,Figaro,"Ahaha! No no, it was absolutely charming! All the girls in Central will fall in love with you for sure."
2463,Rutile,"Mister Lennox, you're so cute."
2464,Lennox,Am I....?
2465,Shino,"Hey Heath, you should give it a try. You've got a pretty face if nothing else, so you'll have the girls squealing in no time."
2466,Heathcliff,"What do you mean, ""if nothing else""....."
2467,Narrator,I breathe a sigh of relief at the lightened mood in the air. Murr twirls through the bright blue sky with gleeful laughter.
2468,Murr,"Ahaha! How fun! Whether they throw stones or flowers at us - it'll still be fun! We are wizards. We can turn things into anything we want them to be. So let's turn the flowers into fireworks; and the stones into jewels! Let's laugh and carry on, regardless of who is watching us - be it bustling crowds, singing flowers, or pallid ghosts!"
2469,Narrator,"His eyes glimmer with the beauty and terror of a burning moon. I freeze in place, captivated, until Chloe flies up beside me."
2470,Chloe,"Hey, hey, Sir Sage."
2471,Akira,"What is it, Chloe?"
2472,Chloe,"Remember how the twins mentioned that we won't look like we're working together because the Northern wizards are missing? I was actually thinking that it'd be nice if we could wear matching clothes - since it's a party and all. But everyone here is so unique, with all different styles, so I had a hard time coming up with a single uniform. That's why....."
2473,Narrator,"Still on his broom, Chloe pulls out his sewing box and flips open the lid. In an instant, matching robes appear atop all the flying wizards."
2474,Chloe,I made us matching robes and outfits instead!
2475,Rutile,"Oh, these outfits are amazing!"
2476,Shylock,"My, they are quite stylish."
2477,Shino,They look really cool.
2478,Snow,We match!
2479,White,We match!
2480,Snow & White,We love to match!
2481,Chloe,I was wondering if we could wear these during the parade!?
2482,Cain,I think that's a great idea. Uniforms make you feel more disciplined and prepared.
2483,Heathcliff,Reminds me of school.
2484,Figaro,"If you can't afford to spare a smile, how about you at least wear this outfit?"
2485,Faust,No; I'm simply going to wear it because I like it.
2486,Lennox,"Thank you, Chloe."
2487,Rustica,"I'm glad everyone loves your outfits, Chloe."
2488,Chloe,Ehehe.... Yeah!
2489,Murr,Oh! Look! Arthur's flying this way!
2490,Cock Robin,"Your Highness! Please, I told you to wait....!"
2491,Arthur,"I've come to pick you up! I'm glad you're doing well, Sir Sage. The carriage for the parade will be that way - we're all ready to go."
2492,Chloe,I've never seen such a fancy carriage! Amazing!
2493,Rustica,"It looks like this will be quite a joyous parade. Let us head onwards, Sir Sage."
2494,Akira,Yes!
2495,Drummond,"Oh, they made it in time! Lord Vincent, the Sage and the wizards have arrived at the outskirts of town!"
2496,Vincent,............ Is that so.
2497,Drummond,"Goodness, making me all nervous like that...... Where are you headed, Lord Vincent? Will you not be observing the parade?"
2498,Vincent,I will leave the rest to you all.
2499,Drummond,I-I understand!
2500,Soldier,Lord Vincent! We have a problem!
2501,Vincent,What now.
2502,Soldier,"I apologize; this report was delayed due to the parade, but the Central tower......"
2503,Vincent,What......?
2504,Narrator,"The Central Country troops briskly march onwards, as the band plays a cheerful, curious tune. Thus our parade starts, with the soldiers taking the lead. The townspeople gather along the main street, some leaning out of their windows, and wave at us with smiles on their faces."
2505,Narrator,(Cheering)
2506,Central Country man,It's the Sage and his wizards!
2507,Central Country man,The wizards from the magic headquarters who defeated the < Great Catastrophe >!
2508,Central Country man,We have nothing to fear from the < Great Catastrophe > as long as they're around!
2509,Central Country woman,"Thank you, dear wizards......!"
2510,Central Country man,Blessings to the wizards of the magic headquarters!
2511,Narrator,"Confetti and flower petals of every color imaginable swirl and dance against the brilliant blue sky. We wave at the townspeople, relieved by their enthusiastic welcome."
2512,Central Country man,Prince Arthur! Long live Prince Arthur!
2513,Central Country woman,"See, look over there! That's our prince! He saved us that day when the catastrophe struck!"
2514,Arthur,"Thank you, everyone."
2515,Narrator,"Being the prince of Central Country, Arthur naturally gets showered with cheers of encouragement and support from the crowd; the other wizards also receive the same reception."
2516,Central Country man,General Cain! Thanks for your hard work!
2517,Central Country woman,Sir Cain! Come have a drink at my shop again sometime!
2518,Cain,"Sure, thanks!"
2519,Central Country girl,Aahh! What a pretty person!
2520,Central Country girl,"I saw him last year, too! He's the Eastern wizard, Sir Heathcliff!"
2521,Heathcliff,............
2522,Heathcliff,..........
2523,Shino,"Hey, at least wave to them."
2524,Heathcliff,"No, that's too embarrassing....."
2525,Shino,"What is? You should take more pride in yourself. You're a chosen wizard, and a dashing beauty who takes after Mistress. There's nothing embarrassing about you, Heath...."
2526,Central Country girl,And the boy next to him is so tiny and cute!
2527,Shino,Did she just call me tiny?
2528,Heathcliff,"She said you were tiny and cute. You should wave to them, Shino."
2529,Shino,"Don't be silly. Times like these, you're supposed to blow them a kiss with your thumb - like this."
2530,Central Country girl,Aaaaah.....!
2531,Central Country girl,"He's cute, but he's also so cool!"
2532,Central Country girl,I love him too!
2533,Shino,Heh. Did you hear them squeal? The girls from Central sure are cute.
2534,Heathcliff,I guess I could learn a thing or two from you when it comes to your nerves of steel......
2535,Central Country woman,Look at those adorable twins!
2536,Elderly Central Country man,My goodness....! I can't believe children so young are working to save the world.... What admirable wizards they are........
2537,Snow,"Good day, Miss!"
2538,White,"Good day, Mister!"
2539,Central Country woman,Good luck!
2540,Elderly Central Country man,"Don't push yourselves too hard, all right?"
2541,Snow & White,Hee hee! All right!
2542,Figaro,"You're putting on an impressive show, Sir Snow, Sir White."
2543,Mitile,Wow.... The streets are filled with people.....
2544,Rutile,"Right, it's amazing! There are more people here than Mister Leno's sheep."
2545,Lennox,You're counting them like sheep.....?
2546,Faust,"Hey, what happened to putting on a smile?"
2547,Lennox,"Oh, that's right. ....Haha. Good afternoon."
2548,Faust,Fufu. You're terrible at this.
2549,Nero,Sigh..... I'm really not a fan of standing out like this......
2550,Chloe,Really? That kind of Eastern sentiment feels like a waste. I love being the center of attention!
2551,Nero,I don't get how you Western wizards are so cheerful.
2552,Chloe,Everyone has their eyes on me! Everyone's waving at me! I feel like everyone loves me....!
2553,Shylock,"Fufu. You're so adorable, Chloe."
2554,Chloe,"Don't you like all this attention, Shylock?"
2555,Shylock,"My specialty is charming people under the light of the moon, not the sun."
2556,Central Country woman,"Hey, sexy guy from the West! Is it true that Western wizards love to deceive and betray women?"
2557,Shylock,Of course it's true.
2558,Rustica,"Of course not, my dear."
2559,Chloe,"You two are completely different types, but you both know you're sexy....."
2560,Shylock & Rustica,To a certain extent.
2561,Rustica,Hm? Could that person over there be my bride....?
2562,Chloe,"Rustica, please! Not here!"
2563,Rustica,But Chloe.... Mmgh.......
2564,Chloe,"Come on, zip your mouth and wave!"
2565,Rustica,"Mggh..... Ahahaha, good day."
2566,Central Country man,"Good day, good wizards!"
2567,Central Country child,"Hey, Mister Wizard, can you show me some magic?"
2568,Murr,Sure!
2569,Narrator,"Murr stands up in response to the innocent child's request and lifts his hand into the air. When he utters his spell, rainbow-colored lights begin to cluster around the ring on his left hand."
2570,Murr,<< Eanul Rambul >>!
2571,Narrator,"They fly high into the air, bursting across the blue sky. And scatter like fireworks. Surrounded by rubble, the people of the city look up at the bright sky with smiles on their faces."
2572,Central Country child,Wow....!
2573,Central Country man,Amazing.... So this is the miracle of magic....!
2574,Central Country woman,I'm sure they'll protect us from the next < Great Catastrophe >!
2575,Narrator,"The crowd erupts into loud cheers of delight, the people's faces lighting up with smiles all around. My heart wells up with pride; I've only known them for a short while, but it makes me happy to hear so much praise for these people who I've come to think of as friends. But amidst the delighted cheers, I hear somber voices."
2576,Central Country man,"......Who are they trying to fool....... The Northern wizards are the crucial ones, but they aren't even here."
2577,Central Country man,They always just do as they damn well please. Things must have ended up like this because they cut corners during the fight against the < Great Catastrophe >.......
2578,Central Country man,"At this rate, the world's gonna end next year......"
2579,Akira,"............ (......I knew it. Everyone's concerned about the Northern wizards......) (Snow and White are also Northern wizards, but......) (......Where are they...... Bradley, Mithra, and Owen......)"
2580,Riquet,......Ah......
2581,Akira,"What's wrong, Riquet? Do you see a familiar face in the crowd......?"
2582,Follower of the church,............Wizards are meant to be the disciples of God! What a deplorable charade!
2583,Central Country man,"Woah, what's wrong with you, old man! Don't start yelling out of nowhere on such a joyous day......"
2584,Central Country man,He's part of that sketchy cult. Just leave him!
2585,Akira,Riquet?
2586,Riquet,......No...... It's nothing.
2587,Cock Robin,"Great work, everyone! The parade was a huge success! Frankly, I was worried that the crowd might throw stones at you, so it was a relief that everyone was so happy to see you!"
2588,Shino,You really don't have a problem speaking your mind.
2589,Cock Robin,Heheh. The party will be held over in that hall. Please enjoy yourselves!
2590,Shino,"Got it. ...Huh, what's that room over there? Is that taxidermy?"
2591,Heathcliff,"Hey, don't wander around, Shino."
2592,Shino,This place is bigger than Blanchett Castle.
2593,Heathcliff,Of course it is. It's where the King of Central Country resides; naturally it's going to be bigger than some castle way out in the woods.
2594,Shino,"But I like Blanchett Castle more. It's surrounded by the forest and a lake; it's beautiful. If Master and Mistress so desired, I would gladly make Blanchett Castle even bigger."
2595,Heathcliff,Father and Mother simply wish to live peaceful lives; they don't ask for much.
2596,Shino,"But I want to grant them everything wonderful in this world. And I feel the same about you, Heath. But I guess I just made trouble for you."
2597,Heathcliff,"....That's not true. I'm always grateful to you, Shino. Because you might be brusque, but you're always kind. When I fell ill and was stuck in bed all day, or when I was feeling down because my tutor scolded me - you always brought me flowers and squirrels from the forest. I still think of you as my little brother."
2598,Shino,Little brother? You're the little brother.
2599,Heathcliff,"What? No, I think everyone would agree that you're the little brother."
2600,Shino,"No, I definitely take care of you more. So you're the little brother."
2601,Heathcliff,"You're so stubborn. Shino, you-...."
2602,Young Central noble,Heathcliff? Are you Heathcliff from the Blanchett family in the East?
2603,Heathcliff,Ah.....
2604,Young Central noble,"Do you remember me? We met at the testing center of the Aristocrat's Academy. I remembered you because you had the best score in the class - plus, you were so handsome. I didn't realize you were a chosen wizard."
