,name,line
7793,Narrator,"Shino's scythe strikes the Minotaur's neck, right on target. Any normal beast would've had its head flying in an instant. But...."
7794,Shino,......Dammit......!
7795,Narrator,"The scythe only scratches the Minotaur's hide; it stands unharmed. Using the centrifugal force of his scythe, Shino spins through the air like a wheel before hitting the ground. And then he runs through the labyrinth once more. He hides amidst the roots and the trees and waits for his next opportunity to strike. Shino is out of breath, but he remains as composed as a hunter laying his traps. If he manages to slowly and keenly chip away at the Minotaur's stamina, bit by bit, maybe he has a shot at winning this battle. -But the very next moment, tragedy strikes."
7796,Narrator,(Roar)
7797,Shino,...........!
7798,Maybe the Minotaur sensed where Shino was,"it slices away the entire corner of the maze where he'd hidden with a heavy blow of its axe. Shino manages to dodge the attack, but it takes him a second to get back on his feet."
7799,Shino,<< MatztzÄh Sudipas >> .......!
7800,Narrator,The Minotaur swings its axe and slices Shino's body right down the front.
7801,Shino,.....Uugh.....
7802,Narrator,(Crash)
7803,Narrator,"And then, in one sweeping sideways motion, the Minotaur tosses Shino several meters into the distance. As Shino struggles to rise to his feet, the monster stampedes towards him with thundering footsteps. I scream. Even though I know my voice won't reach him."
7804,Akira,Shino! Run......!
7805,Obsius,"It's pointless. There is no escaping the Minotaur, the greatest warrior on earth."
7806,Akira,.....What do you hope to accomplish with all this!?
7807,Obsius,I want to reunite with my dearest wife.
7808,Akira,Wife.....?
7809,Obsius,"The briar witch, Talia. The pitiful witch who was cursed for attempting forbidden magic, only to fail and be possessed by the briars in return. Against her will, briars would appear and lash out at all those who dared approach her. And thus, ashamed of her cursed existence, Talia hid herself away in an ancient castle. That was where we met each other. My puppet show was a salve to her lonely heart, her smile the very same to my loneliness. We were meant to live happily ever after, free from this meaningless world and its foolish masses. ......And yet that man incited Talia into destroying herself!"
7810,Akira,......That man......?
7811,Obsius,"The genius of the ages, the philosopher Murr, known for his brilliance! He stole my wife's heart away from me, used her to further his own research, and cast her aside once he was done using her. Unwittingly, Talia was tricked into weaving roses to create a pathway to the moon! She lost herself, weaving away in the ancient castle, and in the end...... She became one with the castle of briars......"
7812,Akira,Became one with the castle......?
7813,Obsius,It's all that man's fault! The great philosopher Murr destroyed my wife and our love for each other!
7814,Akira,"No way...... Murr wouldn't do something like...... ............. (......The current, innocent Murr might not, but the Murr before his soul shattered, I couldn't say for sure......) ......Even if that were the case...... He wouldn't have gotten innocent people involved......."
7815,Narrator,"Laughter rings out from the darkness. The sweet, insolent, charismatic laughter of a voice accustomed to mockery. A strong light glows from the purple sapphire shard. And that bewitching purple light coalesces into a person."
7816,???,"How cruel of you, Sir Sage. I know that one of the many me's out there explained to you..."
7817,Obsius,......! You....
7818,Murr,The one I love is the < Great Catastrophe >. The beautiful moon alone.
7819,Narrator,"The man with a face identical to Murr's takes a bow, so gracious that he seems to be feigning politeness. Then, he smiles at me."
7820,Murr,It's a pleasure to meet you. My name is Murr Hart. Please call me Murr - Sir Sage.
7821,Riquet,......The castle courtyard is like a maze now.
7822,Mitile,"It wasn't like this earlier..... Ah, Mister Heathcliff, come this way.... Are you okay? Are you tired?"
7823,Heathcliff,....I'm all right. Thank you for looking out for me.
7824,Mitile,Not at all.
7825,Heathcliff,But.....
7826,Riquet,"What's wrong, Heathcliff?"
7827,Heathcliff,.....I'm sorry. But could you two escape alone?
7828,Mitile,Mister Heathcliff.....
7829,Heathcliff,"I can't leave Shino on his own. He was putting on a show, pretending he had everything under control, but I know..... That if he thought he could win, he would want me to be there so I could witness it. He wouldn't let me escape like this."
7830,Mitile,....Mister Shino said he would definitely catch up. We should believe in him.
7831,Heathcliff,I've made a promise with Shino.
7832,Riquet,A promise?
7833,Mitile,"But wizards aren't supposed to make promises....? Because if we break our promises, we can't use magic anymore."
7834,Riquet,"It must have been a promise you made with great conviction. ....Right, Heathcliff?"
7835,Heathcliff,"....Not at all. We were just swindled by our master, and..... We made it without understanding a thing. Our promise was to protect each other. That's why.... I need to protect Shino. I still don't know how to face the question that Mister Faust posed to me - I still don't know if my heart is ready for me to be his master, but..... But.... I have to go. I'm sorry."
7836,Mitile,............
7837,Riquet,"What's wrong, Mitile? ....You look pale....."
7838,Mitile,.....Mister Heathcliff. Mister Shino actually asked me to.....
7839,Heathcliff,To what....?
7840,Mitile,"He said that we couldn't beat the Minotaur. So he asked me to take care of you and run, Mister Heathcliff."
7841,Heathcliff,....Wh...... .......I can't believe him......! Now I'm seriously pissed off......!!
7842,Mitile,"P-please don't get mad at him!! Mister Shino was doing it for you, Mister Heathcliff....."
7843,Heathcliff,"I know, but.....!"
7844,Riquet,"Why didn't you tell us, Mitile?"
7845,Mitile,"I did sort of bend to Mister Shino's overwhelming willpower, but.... I was also happy. Because he acknowledged me as a capable, proper wizard. Nobody else treats me like that.... But he said he was counting on me. That's why.... I was so happy......"
7846,Heathcliff,".......... Going by that logic, it means he doesn't trust me."
7847,Mitile,"I-I guess, I guess you could say that, but...... .....Did I make you mad?"
7848,Heathcliff,"I'm not angry at you, Mitile."
7849,Riquet,"But your hands are shaking, Heathcliff....."
7850,Heathcliff,I've never been this mad - I'm so mad that I feel like I could pass out. I don't care about the Minotaur.
7851,Mitile,Y-you're so reliable.
7852,Riquet,"I will pray so that you can feel at peace, Heathcliff."
7853,Heathcliff,I'm heading back to Shino. What will you two...
7854,Riquet,"We'll follow you. As a disciple of God, and as a Sage's wizard, I cannot just sit aside idly as my friend is exposed to danger. Plus, there's a little something that I want to try out!"
7855,Mitile,"Wait, does that mean.... You have the comet tears with you right now?"
7856,Riquet,Yes! Let's see what it does!
7857,Heathcliff,"All right.... If anything happens, you two should run away."
7858,Mitile & Riquet,I won't run away!
7859,Heathcliff,Then your job is to be messengers. I want you two to call for help to make sure we don't die.
7860,Riquet,"Well, if that's the case...."
7861,Mitile,All right. I accept that job.
7862,Heathcliff,Thank you. << Repsevaivulp Sonus >>
7863,Narrator,(Woosh)
7864,Mitile,"Woah, the wind cut straight through.....!"
7865,Riquet,"It created a path straight across the garden, blowing away all the hedges and the plants....!"
7866,Heathcliff,All right. We're clear. Let's go.
7867,Riquet,....He's surprisingly bold.
7868,Mitile,.....He really is a Blanchett - the strongest military family in Eastern Country.
7869,Narrator,"The brilliant scholar Murr, whose soul shattered when he got too close to the secret of the moon. His friend, Shylock, is gathering the shards of Murr's soul in an attempt to restore him, but.... Under the influence of the < Great Catastrophe >, the shards scattered about the world gain physical form from time to time."
7870,Obsius,Why are you here....!?
7871,Murr,Who knows? Perhaps the moon was being mischievous - or perhaps Talia's lonely soul drew me close.
7872,Obsius,.......
7873,Obsius's face twists into an expression that even I can read clearly,"jealousy. Murr coolly tilts his head, his neatly trimmed hair swaying to one side."
7874,Murr,"In any case, it is quite cozy here. I suppose this could be taken as a risque joke, but we are essentially within her body."
7875,Akira,What do you mean? He mentioned earlier that she became one with the castle of briars...
7876,Murr,The briar witch Talia is the ancient castle of roses. She became what she wished to be.
7877,Obsius,"You're wrong! You broke her heart when you cast her aside, and she was possessed by delusions! Why else would anyone wish to become one with an antiquated castle!?"
7878,Narrator,"Obsius glares at Murr, his eyes full of loathing. Murr laughs without even bothering to hide his arrogant look of surprise."
7879,Murr,"Amazing. You really never listened to a single word Talia said. She may not look the way you wish she did, but that does not mean that she is unfortunate."
7880,Obsius,"Silence....! You freakish moon-obsessed charlatan....! You are catastrophe itself! I never listened to her, you say!? I was the one who thought of her, more than anyone else! I visited her - an outcast! - and performed my puppet shows to soothe her loneliness! Because I alone understood her! But then you showed up, and Talia grew infatuated with you, and....."
7881,Narrator,"Murr ignores Obsius, whose voice has risen to a yell, and crosses his legs next to me. He peers into my face with a smile, surprisingly innocent for a soul shard Murr. His expression is filled with fondness for his old friend."
7882,Murr,Sir Sage. Talia was a fascinating girl. She was trying to go to the moon.
7883,Akira,The moon?
7884,Murr,"That's right. She wished to land on the surface of that sparkling moon so that the castle of briars could take root. An ancient castle of roses standing in a world of gold. That was her dream, and she continues dreaming to this day. She dreamed, and dreamed, and dreamed again, until her hair became rose ivy; her hands, castle walls; and her legs, castle gates. And like a ghost ship, she wanders between dimensions, waiting for the day that her dream will come true."
7885,Arthur,"<< Pernoctant Nixzo >>! .....It's not working...... We're surrounded by briars, and the exit to the courtyard is sealed off. Blasting holes in the ceiling and the ground didn't help either......"
7886,Faust,"I know this is a dire situation, but I'm amazed by how enthusiastic you are about blasting holes in the castle's reception hall."
7887,Arthur,Anything to save the Sage and everyone else. I'm sure the first King Alec will understand.
7888,Lennox,............
7889,Faust,Don't look at me.
7890,Lennox,I apologize.
7891,Oz,"......I tried to summon Figaro and the twins, but I simply fell asleep, to no avail."
7892,Arthur,"You said you couldn't reach Cain or Riquet either, right?"
7893,Faust,Are your powers being suppressed?
7894,Oz,"This situation is abnormal. Right now, the castle resembles a human that has been possessed by a dead soul."
7895,Arthur,What do you mean?
7896,Oz,"...... A ghost ship does not exist, but it is still possible for humans to board that ship. And once they do, it is also possible for them to disappear along with it."
7897,Arthur,Yes.
7898,Oz,It is the same thing.
7899,Arthur,"............ The same thing...... Oh, I understand now!"
7900,Faust,......You got it from that explanation?
7901,Lennox,I had no idea what he was getting at...... Central really has excellent students.
7902,Arthur,"In other words, Granvelle Castle has been possessed by a spectral castle."
7903,Oz,"Yes. Like the temples of the original spirits, it originally existed in a world without real form."
7904,Faust,I see...... But why would something like this happen? Granvelle Castle has not committed such grave sins that it would warrant a castle of dead souls possessing it.
7905,Oz,"Someone cast a forbidden curse upon it. They made a promise to offer holy sacrifices to the beasts of the sky, sea, and land."
7906,Lennox,A promise......
7907,Arthur,Sacrifices..... You mean the people sleeping in this castle? I won't let that happen! I'll rouse the castle's inhabitants from their sleep!
7908,Faust,"I agree with Arthur. Those who have fallen to slumber have committed no crimes. ......Besides, I'm worried about Shino and the rest of them."
7909,Lennox,I'm worried about Mitile and the others too. I hope they're all safe......
7910,Arthur,............! I sense someone......!
7911,Aureolin,How dare you intrude upon Father and Mother's grief! I'll be your opponent!
7912,Faust,The blonde girl..... You must be the witch that Cain mentioned.
7913,Arthur,You look like..... The witch who turned to stone on the balcony......
7914,Faust,The witch who turned to stone on the balcony?
7915,Arthur,Yes...... She arrived on the brink of death in the form of a bird. She asked me to take revenge for her sister who was killed by Obsius......
7916,Aureolin,......Obsius? That's my father. He would not kill an innocent witch.
7917,Arthur,You resemble that girl. But...... I also sense Sir Oz's air about you.
7918,Faust,"I sense it too, faintly. Is she related to you by blood?"
7919,Oz,She was created using my blood as a medium.
7920,Arthur,Created?
7921,Oz,That is a puppet.
7922,Arthur,A puppet? This girl?
7923,Aureolin,.....Did you just call me a puppet? Preposterous!
7924,Faust,.......I have to agree with her. I can't believe that she's a puppet; I sense blood flowing through her.
7925,Oz,She is drawing on my blood as a medium. The person who molded her must possess formidable power. They killed witches from each country and harvested their mana stones. They used them to create sacrifices in the images favored by the beasts in order to control them.
7926,Aureolin,Sacrifices?
7927,Oz,Yes. You are the sacrifices for the beasts.
7928,Aureolin,Wh-......
7929,Oz,You will be consumed.
7930,Owen,<< Cure Memimi >>
7931,Narrator,(Roar)
7932,Scarlet,............!! << Volo Habere >>
7933,Cain,<< Gladius Procella >>! ............ ! I'm getting the hang of it.....!
7934,Owen,Hmph. Good for you.
7935,Cain,Yeah! It's all thanks to your advice!
7936,Owen,Haha...... Idiot. I didn't give any advice.
7937,Cain,"Even so, I'm grateful to you. If I keep this up, I can break through!"
7938,Owen,Do as you please.
7939,Cain,"Wait for me, Akira, Arthur!"
7940,Scarlet,...... I won't let you advance further!
7941,Owen,I'm your opponent. << Cuare Morito >>
7942,Scarlet,<< Volo Habe.... >>
7943,Narrator,(Roar)
7944,Scarlet,......Aaahhh......!
7945,Owen,What should I do with you? I'm not as kind as Sir Knight is. Shall I cut you into three and feed each piece to one of Cerberus' heads?
7946,Scarlet,"Well, if you're going to eat me anyway, you wouldn't mind letting me into your stomach, right? << Volo Habere >>!"
7947,Owen,"............ Tsk......! You pesky bastard! You almost blasted a hole through my stomach. You only scratched me, but...... These are rose briars...... ......Briars...... .............. A thorny, dark place...... ............"
7948,Scarlet,Ohoho! I'll turn you into a skewer this time! << Volo Habere >> !
7949,Owen,............
7950,Cain,"Owen, watch out......!"
7951,Narrator,(Footsteps) (Clash)
7952,Owen,............
7953,Cain,"......Are you okay, Owen!? What's wrong with you, spacing out like that!"
7954,Owen,......Ah......
7955,Cain,Owen!? Did you get hit!? Pull yourself together!
7956,Owen,......Sir Knight......
7957,Cain,......That expression...... Don't tell me you're...... The injured Owen......!?
7958,Owen,Sir Knight...... Where are we? I'm scared......
7959,Cain,"......No way...... Not now...... Owen...... Owen! Can you come back? Please, Owen......"
7960,Owen,Come back? From where...... ?
7961,Cain,"I guess not, huh...... Um......"
7962,Scarlet,"Ohoho! What a beautiful friendship you have, looking out for each other......!"
7963,Owen,............! A scary person.......!
7964,Scarlet,Huh? You're plenty scary yourself!
7965,Owen,......She yelled at me...... Sir Knight......
7966,Cain,Hang on a moment. Um...... Let's try to sort this out.
7967,Owen,Let's sort it out......
7968,Cain,"Owen, you can't use magic, right?"
7969,Owen,Right......
7970,Scarlet,Huh? What an outrageous falsehood! You just set those vicious howling dogs on me!
7971,Cain,"Stop, wait a second! It's complicated."
7972,Scarlet,"Well, if you say so...... I suppose I could take a break to enjoy some tea. Staying up late is terrible for my complexion, so I'll have some rosehip tea; it's wonderful for the skin. I wonder if I can find a tea set? Let me look around the castle........ My, what delightful tableware!"
7973,Cain,Owen. Listen closely. It's dangerous here.
7974,Owen,It's dangerous......?
7975,Cain,"Yeah, you can tell by looking around, right? The castle is covered in briars, and the vines are wriggling around."
7976,Owen,Wriggling around......
7977,Cain,"It's really painful when the briars hit you, and the thorns even make you bleed."
7978,Owen,That's scary......
7979,Cain,"That's right, it's really scary. That's why you need to watch out for the briars, and find a place to wait for me over there."
7980,Owen,......No......!
7981,Cain,"I'll come back for you, believe me. I'll beat up the enemy, and then......"
7982,Owen,Don't leave me behind...... Don't leave me alone!
7983,Cain,It'll be more dangerous if I take you with me.
7984,Owen,"No, I'm scared...... The briars are scary....... Sir Knight, don't go......"
7985,Cain,......I have to go.
7986,Owen,Why do you have to go? Why won't you stay with me?
7987,Cain,There are people precious to me trapped in that castle.
7988,Owen,............
7989,Cain,They're probably in trouble; they can't leave because they're trapped by the magical briars. ......I want to save them no matter what. I don't need glory or medals. There are people waiting for me inside the castle - people who fill my heart with pride and light.
7990,Owen,.....Do you want to save them?
7991,Cain,"That's right. You understand, don't you? Don't you feel bad for them, trapped inside that dark castle?"
7992,Owen,............ ......But...... You don't feel bad for me?
7993,Cain,............ ......Owen?
7994,Owen,"I'm still trapped. Left behind, all alone. You're going to save them....... Even though you wouldn't save me?"
7995,Cain,"............? What are you talking about, Owen......"
7996,Owen,............
7997,Narrator,(Growling)
7998,Cain,"............!? Cerberus, where did y-......"
7999,Narrator,(Sickening crunch and spurt of blood)
8000,Cain:......Guh......! ......Ah.......Argh..........It's tearing me apart........Aaahhh...........!,
8001,Owen,............
8002,Cain,......O......wen...........Please stop him! O-........ Ah........Ugh.......
8003,Owen,............
8004,Cain,<< Gladius - >> .........Aah...........
8005,Owen,I was a good boy. I waited obediently for so long. But you never came to save me.
8006,Cain,............O-............
8007,Owen,Just die.
8008,Scarlet,"Fufu....... I had such a lovely teatime. ......Oh my. .....Dear me, did you have a disagreement? The white-haired man's three-headed dog is devouring the red-haired man. I guess the two of you didn't really get along. Even though your eyes are the same color."
8009,Chloe,.....The vines are all over the place here too..... Ouch.... The thorns caught me again.
8010,Rustica,Are you all right?
8011,Chloe,"Yeah. This is just a scratch, but.... There's no opening for us to get into the castle."
8012,Rustica,"You're right. The sky is covered in vines, too; I don't see any way out by flying."
8013,Chloe,"It was such a pretty castle, but now it's like a ghost...... ....We were supposed to have a special ceremony, too.... I wonder if they're going to blame us again? Is everyone going to say this was all the wizards' fault....."
8014,Rustica,I'm not too sure about that. The people in the castle have all fallen asleep.
8015,Chloe,"....It makes me sad..... I guess there really is no such thing as an outcast who becomes the hero of a story; that's just wishful thinking. No one ever loves an outcast; it doesn't matter if he does good things or bad things. He's still an outcast. Even if we do our best to save people tonight, tomorrow, the people we saved.... Might sigh, and say, this is why we can't trust wizards. ....What do you think, Rustica? Do you ever feel like that....? Am I thinking this way because I have an awful personality....?"
8016,Rustica,"You're a kind, good boy."
8017,Chloe,"....I don't know about that. Whenever these sorts of thoughts cross my mind, I can't bring myself to say, ""Thank you."""
8018,Rustica,You don't have to.
8019,Chloe,.....Yeah.....
8020,Rustica,"....Oh my, the rain..... ........! << Amorest Viesse >>"
8021,Chloe,"Woah....! You surprised me, tugging me close out of nowhere!"
8022,Rustica,Because the rain falling from the sky isn't any old rain. Look.
8023,Chloe,Ah! You're right.... The bricks and briars are melting away.
8024,Rustica,But this might be a blessed rainfall that gets us through this conundrum.
8025,Chloe,Huh....?
8026,Rustica,Shall we practice magic?
8027,Chloe,H-huh? Right now? I have such a laid-back master.....
8028,Rustica,"Right now is the time to practice. Look up to the sky, Chloe. What do you see?"
8029,Chloe,".....Um.... Dark clouds, and the heavy shadows of the briars....."
8030,Rustica,"The moon isn't very bright tonight, after all. But look closely."
8031,Chloe,....If only the < Great Catastrophe > shone a little brighter......
8032,Rustica,"That's right. It's what we all pray for on the darkest nights: ""Let there be light."" But Chloe, I know you can find the answer, even amidst the dim gloom. Even on nights where you can't say ""thank you""; nights where you feel like a lost, unrewarded specter; nights where you might become a terrifying monster. For you are a wizard, after all."
8033,Chloe,............
8034,Rustica,"Listen to the wind and touch the shadows of the invisible - find the long-lost words of the past..... We are wizards. We dance and sing under the very light of the moon that humans fear, frolicking alongside everything in this world."
8035,Chloe,............
8036,Rustica,Now open your eyes wide. Look into the dark night to find the wonderful things that make your heart dance - the things that give you courage.
8037,Chloe,"........ -Ah! Murr! Shylock! Nero and Bradley are there too! Thank goodness! Everyone's all right....! They're zipping through the sky fighting a giant bird! Amazing....! Rustica, look! Our friends are fighting!"
8038,Rustica,"That's right, Chloe."
8039,Chloe,".....We need to do our best too! I feel like we can do this! Because..... We're wizards, after all! We can turn the worst into the best, and pull miracles out of the air!"
8040,Rustica,Of course.
8041,Chloe,"Ah....! When the briars over there melt, we can enter the castle from that window!"
8042,Rustica,"Excellent! Once we manage to open up an entrance, let's get Cain and Owen."
8043,Chloe,"Yeah! Wait for us, Sir Sage! We'll save you!"
8044,Heathcliff,"....Pant, pant...... .....Shino......"
8045,Riquet,.....Heathcliff! Isn't that thing shining over there Shino's scythe!?
8046,Heathcliff,You're right.... It's stuck in a tree trunk..... .....Shino.....! Where is Shino......!?
8047,Narrator,(Roar)
8048,Mitile,The bull-headed monster......! ......Ah......!
8049,Riquet,No way.....! Is the bright red thing in the monster's arm.....!?
8050,Heathcliff,Shino.....!! You bastard! How dare you......
8051,Narrator,(Roar)
8052,Heathcliff,<< Repsevaivulp Sonus >> !
8053,Mitile,Woah......! The garden hedges are stretching and clinging to the bull monster!
8054,Riquet,Let's help him out! << Sunrotea.... >>
8055,Viridian,Don't get in my way.
8056,Mitile,.....You're......
8057,Viridian,Ah.... It's you from earlier......
8058,Mitile,Mister Heathcliff! Riquet! Leave this girl to me and go help Mister Shino!
8059,Heathcliff,"Thanks, Mitile!"
8060,Riquet,Be careful! Mitile!
8061,Viridian,Ah......
8062,Mitile,I won't let you through! Are you a witch? Why are you doing such terrible things!? Bad wizards like you are the reason everyone has the wrong idea about all wizards!
8063,Viridian,I'm not doing anything bad. I just want to meet Mother.
8064,Mitile,.....Mother.....
8065,Viridian,"And if you get in my way, I'll turn you to stone. << Volo Habere >>"
8066,Shino,"(...My whole body hurts..... What's this smell....? It's the metallic scent of blood - and greenery....) (The scent of Sherwood Forest, protecting Blanchett Castle.... ....My dwelling.....)"
8067,Shino,(....No. What's with these leaves and branches growing from the monster's body....?)
8068,Narrator,(Roar)
8069,Shino,".......!! Cough, cough..... Dammit! Hurling me around like that......"
8070,Heathcliff,Shino......!
8071,Shino,........... .....Heath!? Why did you come back!? .....Stay away.....!
8072,Heathcliff,......What!?
8073,Shino,"Hurry, run awa..... Agh......"
8074,Heathcliff,Look at you! You've lost too much blood! I'll lend you my shoulder......
8075,Riquet,"Heathcliff! I managed to bind the monster with branches from the courtyard, but it's going to rip through any moment now....."
8076,Shino,.....Let me go. Where's my hunt?
8077,Riquet,Hunt? Your scythe is in that tree.....
8078,Shino,<< MatztzÄh Sudipas >> ! Return to my hands!
8079,Heathcliff,Stop using magic! You were on the brink of death!
8080,Narrator,(Swish)
8081,Shino,But I'm not dead. ....All right. I'm gonna finish it off. You guys should run.
8082,Heathcliff,......... I will really get mad.
