,name,line
4628,Narrator,(Flips page)
4629,Akira,......On wizards......
4630,Narrator,"""On wizards."" ""I've been thinking a lot about the wizards. At first, I thought they were like Superman."" ""Or like troublesome supernatural beings, or local gods who make lots of requests."" ""They have miraculous magical powers, and they can easily do whatever they want. I thought they must be the real winners in life."" ""But that wasn't true."" ""They're the same as me."""
4631,Akira,............ ......The same......
4632,Narrator,"""The wizards here live their lives carrying the burden of defeating the < Great Catastrophe > that arrives once a year."" ""I lived the same kind of life back when I was a salaryman. I laughed like an idiot, but I was always anxious."" ""Is there a way out of this unchanging lifestyle?"" ""Is there any meaning in going out of my way when nobody expects anything of me?"" ""If I manage to be useful and people praise me for it, will that really make me happy?"" ""Will someone out there listen to what I want?"" ""How am I supposed to forge connections with people?"" ""Why does nobody say thank you to me? Is it because I'm a worthless person?"" ""If I were a wizard......"" ""Would anyone need me for anything other than my magic?"" ""......I still haven't found the answers to these questions. I don't think they've found them either."" ""That's why, at the very least......"" ""I want to be their friend."" ""I want to give them a place where they can be their true selves."" ""You need a place where you can laugh at your mistakes and let them go, or else you can't muster up the courage to take a step forward."" ""No one wants to shoulder a role where you're only going to be attacked over your responsibilities."" ""At least in this world, I want to be a friend who can say, â€˜What are you doing (lol)' to them."" ""'Don't worry about it.' 'You did a great job.' 'Take a break. Let's work later.'"" ""I want to be a friend who can say that to them."""
4633,Akira,......Sir Sage......
4634,Akira,........
4635,Narrator,"Without realizing, I'm moved to tears while reading the sage's manual. I feel the same. I want to become friends with the wizards. I want to be someone they can smile freely around. We don't have to get along like family. Just like the stray cats who ran away when they first saw me, but, little by little, meowed and came closer to me. I want to build a small bridge of trust. Even if it's a thin, unreliable string, like a spider's web on a rainy day...... As long as there's something you can grasp with your own fingertips, you can carry on walking in this wide world, even if you're all alone."
4636,Faust,........
4637,Figaro,What are you doing out here so late at night?
4638,Faust,Figaro.....
4639,Figaro,Do you plan on leaving this place without a word?
4640,Faust,........... This has nothing to do with you.
4641,Figaro,Faust. The Granvelle monarchy has continued for generations after Alec's death.
4642,Faust,Your point is?
4643,Figaro,If your wounds haven't healed after being alone for all those years - that means you need someone else.
4644,Faust,........... .......I don't need anyone.
4645,Figaro,You're so stubborn. Though I guess you've always been this serious and stubborn. The Faust I knew was a pure and noble hero. There were people who kissed your shadow. Yet now you make a living out of cursing people?
4646,Faust,Shut up. Go away.
4647,Figaro,"Wait, hear me out. How does this sound? I'll steal your specialty."
4648,Faust,What are you trying to say?
4649,Figaro,"I'm going to curse you, Faust. You don't know what your bizarre injury is. The same goes for Heathcliff. You can't leave that child alone. Because if you leave this place, there will only be irresponsible wizards left. And the responsible ones have little magic power. Cain and Lennox - they don't stand a chance against me, or Oz, or Mithra and the others. You need to stay here. Or else Heathcliff, and the stubborn Shino, and Nero, who has trouble getting along with others - they'll all get beaten down."
4650,Faust,".....Even if I'm gone, there's still Snow and White......."
4651,Figaro,"Sir Snow and Sir White are like epitome of carelessness! They were my masters, as well as Oz's!"
4652,Faust,............
4653,Figaro,"But you don't have to worry about that. Forget about those poor young boys, and enjoy your good old solitary confinement. That is my curse; you know very well how words can also form curses. Take care."
4654,Faust,........You coward....!
4655,Figaro,One more word. I'm probably going to die soon.
4656,Faust,..............
4657,Figaro,"Maybe in fifty years.... maybe in five. It might even be next year. I guess it's true, what they say about wizards knowing when they're about to die. Tiretta realized that she was going to die, too."
4658,Faust,...... ......You're lying.....
4659,Figaro,"Unfortunately, I'm telling the truth. Please don't tell anyone else. You're the first person to hear this from me. Sir Snow and Sir White might have noticed. I'm not too sure about Oz; he can be a bit dense..... In any case, I'll turn to stone soon enough."
4660,Faust,......Why are you telling me?
4661,Figaro,"When I realized that I didn't have much time left - for the first time, I seriously thought about the world that you and Alec dreamed of. A world where humans and wizards can live together in harmony.... That's the world I want to leave behind for the children. And in order to accomplish that, I need your power."
4662,Faust,......... .....You're lying. I refuse to believe you. You're just trying to fool me with a nasty lie.
4663,Figaro,"That might be true. So this is something like a curse, too."
4664,Faust,..........
4665,Figaro,"Good night, Faust."
4666,Riquet,.........
4667,Nero,You're still awake? It's way past bedtime for kids.
4668,Riquet,Nero......
4669,Nero,Did you get a little hungry?
4670,Riquet,Why did you stop me from leaving? You were the one who said that wizards could never be with other people......
4671,Nero,There was no deep reason for it. I just thought you shouldn't have to go back to a place where they wouldn't even feed you a decent meal.
4672,Riquet,......
4673,Nero,Didn't my cooking taste good?
4674,Riquet,Yes......
4675,Nero,Tomorrow's breakfast is gonna be bread pudding.
4676,Riquet,Bread pudding......?
4677,Nero,"Haha...... It's crispy, soft, and sweet."
4678,Riquet,That sounds delicious......
4679,Nero,"Doesn't it? Now you have something to look forward to as you head off to bed. That's what kids should do. Just think about what you're gonna eat tomorrow, and drift away into the land of sweet dreams. Good night, Riquet."
4680,Riquet,"Good night, Nero. ......Also, let me say one thing."
4681,Nero,What is it?
4682,Riquet,"You said you weren't cut out to live with others, but...... I like the time that I spend with you, Nero."
4683,Nero,......
4684,Riquet,"The food that you make - while you act like it's a pain, but also like it's no big deal - in my eyes, those meals are a miracle as wondrous as a dream. And the words you offered me today, when you told me to stay. Those words were for me, not for a disciple of God. You didn't say, ""Eat this""; instead, you asked me, ""Which one do you like?"" That was how I discovered what I loved for the first time in my life. I came to realize what kind of person I was...... And that's terrifying, but it's also exciting - and I look forward to seeing what comes next."
4685,Nero,Riquet......
4686,Riquet,"I'm sure I'll wake up early tomorrow. I can't wait to open my eyes in the morning. Thank you, Nero. Thank you for giving me a reason to look forward to tomorrow."
4687,Vincent,Did you find the culprits who ransacked the cemetery?
4688,Soldier,"We're still investigating...... Everyone is spooked, you see......"
4689,Vincent,"How absurd. It's probably just robbers who used the attack of the < Great Catastrophe > as a cover to steal burial goods from the graves. Even if there was magic at work, we can handle anything so long as we have the Magical Technology Corps on our side. How is Nicholas doing?"
4690,Soldier,It seems like he just regained consciousness......
4691,Nicholas,............
4692,Vincent,Nicholas.
4693,Soldier,Sir Nicholas......
4694,Vincent,"I hear that the Northern wizard Owen manipulated your heart. As the leader of the Magical Technology Corps, you are not setting a proper example for your subordinates."
4695,Nicholas,"............ Forgive me, Lord Vincent. I shall offer my life in apology."
4696,Vincent,What?
4697,Soldier,The darkness is swarming around him......!
4698,Vincent,Wh......
4699,Soldier,Lord Vincent! There's the shadow of a bird looming behind Sir Nicholas......!
4700,Nicholas,............
4701,Soldier,The shadow......! The bird's shadow is swallowing up Sir Nicholas!
4702,Nicholas,......I...... ......Wanted to......
4703,Narrator,(Squawk)
4704,Vincent,What......?
4705,Soldier,"It completely swallowed him......! Lord Vincent, please escape!"
4706,Vincent,......!
4707,Narrator,(Squawk)
4708,Soldier,I-it seems to have flown away! We have to notify Sir Drummond and the Sage's wizards immediately......!
4709,Vincent,Wait! It might be some kind of magical technology that Nicholas obtained!
4710,Soldier,No way......! Sir Nicholas was just swallowed by the bird's shadow......
4711,Vincent,Silence! Do not utter a word of this to anyone. Understand?
4712,Soldier,Y-yes......
4713,Vincent,"......If the Sage's wizards continue to strengthen their reputation through achievements, Arthur is going to win more popularity with the people. If Arthur had never returned to the castle, I would have been the next king. What do wizards know of the human world? I am the one who is suited for the role, not Arthur......"
4714,Skinny Central child,Uu...... Uuu......
4715,Mithra,......
4716,Skinny Central Country child,Uu...... My stomach hurts...... Uu...... Ehehe...... But if I make it through...... Then this thing will be mine......
4717,Mithra,You're right.
4718,Skinny Central Country child,Ehehe...... Uuu...... Fufu......
4719,Mithra,"The Umbra Volans is swooping through the land. It should begin soon. I do hope you entertain me, Sir Sage."
4720,Narrator,A few days later-
4721,Cain,Prince Arthur hasn't sent word from the Central capital yet. I wonder how he's doing...... Should I go check on him in secret?
4722,Shylock,I would recommend against it. We have essentially been ordered to quarantine ourselves here.
4723,Cain,But we need to find the culprit behind the incident at the Lunar Eclipse Palace....
4724,Shylock,"Of course. That is why, until things calm down, we need to do all the investigating we can here at the magic headquarters."
4725,Cain,Investigating? At the magic headquarters......? Wh-what's with this mountain of massive books!?
4726,Shylock,Please research the Umbra Volans.
4727,Cain,"......... You see, I'm not very good at deskwork....."
4728,Shylock,I know very well. You mischievous boy.
4729,Snow,"Umbra Volans, Umbra Volans......"
4730,White,What was it again......
4731,Chloe,"Please try your best to remember! Murr apparently said that you two would know about it! Right, Murr!"
4732,Murr,Looks like it!
4733,Snow,Hmm...... I feel like I might remember if I ate something sweet......
4734,White,Maybe if someone massaged my shoulders......
4735,Chloe,"You said that yesterday, too. Geez, you keep repeating yourselves~."
4736,Murr,It's because they're old geezers!
4737,Snow,We're not old geezers!
4738,White,We're not old geezers~!
4739,Figaro,"And we still don't know anything about the piece of equipment that belonged to the Magical Technology Corps, right?"
4740,Shylock,"Even if they'd found anything, they might not report it to us. For it could very well cause a scandal for Central Country."
4741,Figaro,"I'd welcome a scandal or two - otherwise, they're going to start hunting wizards."
4742,Akira,You mentioned that before. What does that mean?
4743,Figaro,"Magical technology is fueled by mana stones. Mana stones are the stones of wizards - they contain their magic powers. Mana stones are being burned more quickly than ever now due to the emergence of magical technology equipment. Eventually, we'll run into a shortage of mana stones. And when there's a shortage, what will humans do? I think the Western wizards know the answer to this question. Shylock. I hear that in Western Country, they hunted magical creatures to the brink of extinction."
4744,Shylock,"It's just as you say. With the advancement of science, the West has entered an era of madness. Western Country has always been lacking in morals. But now that the citizens' desires have grown exponentially - they've become unstoppable."
4745,Figaro,"Back in the day, we thought it was impossible for humans to kill magical beasts. But now there are too many humans. And with the development of magical science weaponry...... If a weak child like Mitile were attacked, he'd get turned into stone. I want to prevent that kind of future from coming to pass."
4746,Cain,We need to start by getting people to trust wizards. Where in the world is the root of all evil - Owen?
4747,Snow,I wonder.
4748,White,"We're not close enough to pay him a home visit, you see."
4749,Cain,"This is about the Northern wizards, so please, pull yourselves together. What are Owen's special characteristics?"
4750,Snow,"He can speak to beasts, such as wolves. He was a huntsman, after all. He's also skilled at absorbing magic."
4751,White,"Wizards usually obtain their magic from nature, but Owen is a bit special."
4752,Snow,He gains his power from human emotions. That's why we think he can't be too far from where humans live......
4753,Narrator,(Door opens)
4754,Heathcliff,......Sir Sage.
4755,Akira,Ah...... What is it?
4756,Heathcliff,"I apologize for interrupting, but Shino came across a visitor just now......"
4757,Shino,We have guests. Can I bring them in?
4758,Akira,Guests......?
4759,Narrator,"The person that the two Eastern youths bring over is - Central Country's secretary, Mister Cock Robin. Alongside a beautiful lady with an air of competence around her."
4760,Cock Robin,"It's been a while, Sir Sage. Um, this is......"
4761,???,"I'm Canary, Cock Robin's wife. Thank you for taking care of my husband. Could you let me work here too?"
4762,Akira,Work here at the magic headquarters......?
4763,Canary,"Yes! I just couldn't sit still after hearing what he told me! The world was saved thanks to Sir Sage and his wizards, yet you don't even have anyone to take care of you! If you don't mind, I'd love to help out - I can do cleaning, laundry, you name it!"
4764,Akira,Th...... Thank you!
4765,Canary,"That's not all. Come on, say it."
4766,Cock Robin,"Hey, give me a moment...... I need to prepare......"
4767,Canary,Stop mumbling. Muster up some courage!
4768,Cock Robin,......
4769,Narrator,"Miss Canary pushes him forward, and Mister Cock Robin approaches me. He nervously opens his mouth, book and pen in hand."
4770,Cock Robin,I...... I'm a scribe...... Making a record of events is my job.
4771,Akira,Yes......
4772,Cock Robin,"I was wondering if you would let me write about everyone here until the next < Great Catastrophe > arrives? And, if possible, I'd like to report my writings to the castle."
4773,Akira,Why would you...... Is it because you don't trust us......?
4774,Cock Robin,"No, it's the other way round. I want them to understand - what wizards are like, and how they saved the world, and so on. What kind of situation you're in, what you're thinking, what's bothering you...... Neither the people in the castle nor the townspeople know anything about you. I was the same. That's why I was scared...... But the wizards still saved me. I want to keep a proper record, so I can convey that wizards are not who people think they are; that they're working this hard for our sake. I'm sure I met the previous sage a number of times, but for some reason I can't remember his face or his name...... But if we kept a proper record, then I'm sure we'd all be able to remember. We would know that the Sage was here, and we would remember the things that he did."
4775,Akira,Mister Cock Robin......
4776,Cock Robin,"This was actually Sir Drummond's suggestion. But he said to keep it a secret, so please don't tell him...... He said that wizards were the ones who helped us when the world was in trouble - when I was in trouble. He didn't want you to think that humans are all ungrateful."
4777,Narrator,"I recall Mister Drummond's face, and my chest grows warm. There are still humans who care about wizards like this. That alone makes me happy."
4778,Akira,Thank you...... I'm sure everyone else will be delighted too.
4779,Cock Robin,Yes!
4780,Canary,"Sir Sage, mister wizards. I'm sure there will be lots of trouble lying ahead of you all, but please never give up. I'll cheer you on with everything I've got!"
4781,Narrator,"With Mister Cock Robin and Miss Canary's arrival at the magic headquarters, the wizards begin to regain their spirits."
4782,Cock Robin,"Time to record everything I can! So when wizards use too much magic, their hearts become exhausted, and they grow fatigued......"
4783,Murr,Boo!
4784,Cock Robin,......You surprised me! Why did you do that?
4785,Murr,Because I like surprising people.
4786,Cock Robin,.....
4787,Narrator,(Writing sounds)
4788,Cock Robin,The Western wizard Murr enjoys surprising people......
4789,Murr,You're writing it down! What a diligent guy!
4790,Canary,Delicious! I didn't realize the extra step would make it taste so much better.
4791,Nero,"Glad I could help. Okay, I need to go now......"
4792,Canary,"Mister Nero, could you teach me more about cooking from now on? If you don't mind, that is."
4793,Nero,............
4794,Canary,"I'm not that good at cooking, I'd be very grateful for your help."
4795,Nero,I guess...... Once in a while......
4796,Canary,Great! Thank you very much!
4797,Nero,Haha...... You're welcome.
4798,Shino,We still don't know what Heath's bizarre injury is?
4799,Heathcliff,Don't bring it up...... I'm getting more and more anxious.
4800,Cain,Hopefully it's not one of the painful types. Shylock looks like he has it rough. Though it's pretty inconvenient not being able to see people until I touch them.
4801,Shino,What kind of injury could you handle?
4802,Heathcliff,Umm...... Sneezing yourself into the distance seems kind of fun.
4803,Bradley,You bastard.
4804,Heathcliff,.......I-I didn't realize you were around.
4805,Bradley,"""Seems kinda fun?"" This isn't a damn joke."
4806,Shino,"Oh, so you get blasted away seriously?"
4807,Bradley,The hell!?
4808,Cain,"Don't threaten them, Bradley."
4809,Bradley,"First things first, you bastards need to...... Ah-choo!!"
4810,Narrator,(Poof)
4811,Shino,.......... He's gone.
4812,Heathcliff,"Yeah, that does seem fun."
4813,Narrator,(Footsteps)
4814,Riquet,I'm sorry! Mitile and I were blowing dandelion puffs!
4815,Mitile,Did they come this way?
4816,Cain,No worries. You guys did a great job.
4817,Narrator,That night-.... I witness a new bizarre injury.
4818,Akira,......I woke up in the middle of the night...... Guess I'll have a cup of tea before I go back to bed...... ......Huh......? What is this......?
4819,Narrator,A quiet illusion floats along the moonlit corridor. It's a cluster of lilac-colored flower petals. But they disappear in an instant.
4820,Akira,......Ah...... It turned into snow......
4821,Narrator,"In an instant, the dancing flower petals turn into fine snow. But the snow disappears before it has a chance to pile up, like churning sea foam dissolving between the waves. I chase after the wondrous illusion that comes drifting my way from above the stairs."
4822,Akira,......It's coming from the door to that room...... That's...... Faust's room......
4823,Lennox,Sir Sage.
4824,Akira,Lennox......
4825,Lennox,What are you doing up so late? ......Where is this snow coming from......?
4826,Akira,It seems to be spilling out from the cracks in Faust's door.
4827,Lennox,Sir Faust's......
4828,Narrator,Lennox falls silent. The dancing snowflakes gradually turn into glowing red sparks. The sparks don't catch fire; they simply vanish in silence. But I still grow concerned.
4829,Akira,"......Is this some kind of spell? Lennox, do you know what this is?"
4830,Lennox,No......
4831,Narrator,(Knock knock)
4832,Narrator,"After hesitating for a moment, I knock on Faust's door."
4833,Akira,Faust...... Faust.
4834,Narrator,"There's no response. Under the dark moonlit night, the red glow of the sparks burns even brighter."
4835,Lennox,"He might have set up a barrier. Sir Faust is a very cautious person, after all."
4836,Figaro,What are you two up to?
4837,Akira,Figaro......
4838,Narrator,"Figaro calls out to us from below the stairs. Before we can reply, Figaro notices the strange affair and furrows his brows. The fire burns with greater intensity, the flames curling out from behind the doorframe."
4839,Figaro,Stand back. I'll open the door.
4840,Narrator,Figaro places his hand on the doorknob and solemnly chants his spell.
4841,Figaro,<< Possideo >>
4842,Narrator,The doorknob turns as the sound of his magic slices through the air.
4843,Narrator,(Door opens)
4844,Akira,......Ah......
4845,Narrator,"I fall silent at the scene that greets us beyond the door. A blazing, furious fire surrounds the bed where Faust sleeps. And every corner of the room overflows with strange illusions that crowd around him. The window reflects the hill of execution. On the ceiling: a boy who looks just like Arthur. Figaro and Lennox are there, too And Faust, who is surrounded by people who love and respect him, wearing a calm and gentle smile on his face. Yet I can also see a scene of Faust being crucified and burned at the stake."
4846,Lennox,......These must be...... Sir Faust's dreams......
4847,Akira,Faust's dreams......
4848,Faust,......Nn......
4849,Narrator,"Faust stirs slightly. We hold our breath, and Figaro speaks."
4850,Figaro,Let's get out of here before he wakes up.
4851,Narrator,We leave Faust's room and walk through the courtyard. The sight we just witnessed is seared into my mind.
4852,Lennox,......Was that the bizarre injury that the < Great Catastrophe > left on Sir Faust?
4853,Figaro,Probably. It looks like the exact thing he would hate more than anything else in the world.
4854,Akira,Were those illusions in Faust's room images from his past......?
4855,Figaro,"It wasn't just his past; his desires probably manifested a part of those images, too. I didn't participate in the final battle."
4856,Akira,Why......?
4857,Figaro,"I abandoned the front lines. Faust still resents me for it. But I didn't leave because I was struck by panic. Victory was right before our eyes. We all believed the human Alec and the wizard Faust would establish a new, ideal country. I never thought that Alec would be swayed by his close aides and end up actually executing the wizards."
4858,Akira,......Execute......
4859,Lennox,Of course it was possible to resist execution. But Sir Faust believed that Sir Alec would never carry it out........ Until the very moment the fire was lit......
4860,Akira,..........
4861,Lennox,"I will never forget that day...... But I never realized that he still dreamed of it so vividly, even now...... I don't think I could possibly ever imagine.... The sheer depth of his pain."
4862,Figaro,"If he discovers the truth about his bizarre injury, Faust will probably say that he's leaving the magic headquarters. We all have our pasts that we would rather hide from others. If his overflows while he's unconscious...... He could probably prevent his dreams from overflowing by establishing an even more powerful barrier, but there's no reason for him to go through that effort just to stay here. If we stay silent, then everything will remain within the realm of dreams. He might not realize what's going on...... I'll leave the decision to you, Sir Sage."
4863,Akira,"........... Lennox, are you all right with that?"
4864,Lennox,......I would like you to tell him what's going on. Even if it ultimately leads to Sir Faust leaving the magic headquarters...... I don't want to rob him of anything else that he might trust.
4865,Akira,............
4866,Narrator,"After thinking about it for a night, I decide to tell Faust."
4867,Faust,............
4868,Narrator,"Faust looks shocked, but he listens till the end without saying a word. He doesn't get mad, or try to run away; he simply stands there in silence, as if he's enduring everything I'm telling him."
4869,Akira,"......If you choose to stay here, I will do anything I can to support you, Faust. I will figure out how to keep you from getting hurt. I can't force you to stay, but please consider it."
4870,Faust,"............ Why did you tell me? If you had stayed silent, I might never have realized what was going on."
4871,Akira,"I really would like you to stay here at the magic headquarters, Faust. But...... Nobody wants other people to find out about their deepest secrets. Hiding this from you while relying on you for your knowledge and magic - I didn't want to take advantage of you like that. I wanted you to believe in me...... I wanted you to stay here because you trusted me."
4872,Faust,............ ......I see. I'll remain.
4873,Akira,Faust......
4874,Narrator,"He lowers his eyes, falling silent."
4875,Faust,......But I want to set up a powerful barrier to prevent my dreams from overflowing. I'll head out to the East in order to obtain the appropriate medium. I will be gone for a while. Is that all right?
4876,Akira,"Of course...... Thank you, Faust."
4877,Faust,Not at all.......
4878,Lennox,Sir Faust. Please take me with you.
4879,Akira,Lennox......
4880,Lennox,"I'm sure I can at least serve as a watchguard. Please, let me join you."
4881,Narrator,"Faust looks ambivalent. But he doesn't glare at Lennox in displeasure; instead, he sighs softly."
4882,Faust,There's nothing I can do for you anymore.
